{"$schema":"https://json-schema.org/draft/2020-12/schema","type":"object","required":["audit_id","title","target_reference","audit_type","auditor_id","scope","evidence_refs","findings","conflicts_of_interest","recommendation","timestamp","status"],"properties":{"audit_id":{"type":"string","pattern":"^AUD-[A-Z0-9-]+$"},"title":{"type":"string"},"target_reference":{"type":"string"},"audit_type":{"type":"string"},"auditor_id":{"type":"string"},"scope":{"type":"string"},"evidence_refs":{"type":"array"},"findings":{"type":"array"},"conflicts_of_interest":{"type":"object","required":["declared"]},"recommendation":{"type":"string"},"timestamp":{"type":"string","format":"date-time"},"status":{"enum":["draft","completed","example_not_actual"]}},"additionalProperties":false}
