{"audit_id":"AUD-EXAMPLE-0001","title":"EXAMPLE — NOT AN ACTUAL AUDIT","target_reference":"EXAMPLE-NOT-VALIDATED","audit_type":"example","auditor_id":"example-placeholder","scope":"Schema illustration only; no real finding.","evidence_refs":[],"findings":[],"conflicts_of_interest":{"declared":false},"recommendation":"No operational action.","timestamp":"2026-10-02T00:00:00Z","status":"example_not_actual"}
